[
  {
    "sessionId": "2025-05-25-model-init",
    "timestamp": "2025-05-25T05:00:00.000Z",
    "developer": "harshit-codes",
    "status": "completed",
    "focus": "HuggingFace Model Initialization",
    "achievements": [
      "ModelInitializer class",
      "Enhanced EmbeddingManager",
      "Setup integration",
      "Testing framework"
    ],
    "blockers": [],
    "nextSteps": [
      "End-to-end pipeline testing"
    ],
    "filesChanged": [
      {
        "path": "src/setup/model-initializer.ts",
        "type": "modified",
        "description": ""
      },
      {
        "path": "src/mcp/handlers/setup.ts",
        "type": "modified",
        "description": ""
      },
      {
        "path": "src/vectorizers/embedders/manager.ts",
        "type": "modified",
        "description": ""
      },
      {
        "path": "tests/unit/model-initialization.test.ts",
        "type": "modified",
        "description": ""
      }
    ],
    "learnings": [
      "Free-tier HuggingFace models work well with health checking"
    ],
    "notes": "Complete model initialization system with CodeBERT primary and BGE fallback",
    "duration": 90,
    "tags": [
      "testing",
      "integration",
      "setup"
    ],
    "priority": "medium",
    "complexity": "complex",
    "relatedSessions": [],
    "metadata": {
      "version": "2.0.0",
      "toolsUsed": [
        "HuggingFace",
        "Testing"
      ],
      "environment": "development",
      "codebaseSize": 115,
      "testsCovered": true
    }
  },
  {
    "sessionId": "2025-05-25-doc-system",
    "timestamp": "2025-05-25T06:30:00.000Z",
    "developer": "harshit-codes",
    "status": "completed",
    "focus": "Session Tracking System Redesign",
    "achievements": [
      "CSV session tracking system",
      "Analysis tools",
      "Documentation restructure"
    ],
    "blockers": [],
    "nextSteps": [
      "Test new system with real usage"
    ],
    "filesChanged": [
      {
        "path": "vibe-sessions/README.md",
        "type": "modified",
        "description": ""
      },
      {
        "path": "vibe-sessions/sessions.csv",
        "type": "modified",
        "description": ""
      },
      {
        "path": "vibe-sessions/analysis/session-stats.py",
        "type": "modified",
        "description": ""
      }
    ],
    "learnings": [
      "CSV format enables powerful querying and snapshot approach allows granular tracking"
    ],
    "notes": "Redesigned session tracking from markdown to structured CSV format",
    "duration": 45,
    "tags": [
      "documentation",
      "analysis"
    ],
    "priority": "medium",
    "complexity": "moderate",
    "relatedSessions": [],
    "metadata": {
      "version": "2.0.0",
      "toolsUsed": [
        "CSV"
      ],
      "environment": "development",
      "codebaseSize": 115,
      "testsCovered": false
    }
  },
  {
    "sessionId": "2025-05-25-doc-finalize",
    "timestamp": "2025-05-25T07:15:00.000Z",
    "developer": "harshit-codes",
    "status": "completed",
    "focus": "Session Tracking System Finalization",
    "achievements": [
      "Analysis script completed",
      "README documentation",
      "System integration"
    ],
    "blockers": [],
    "nextSteps": [
      "Implement in real workflow"
    ],
    "filesChanged": [
      {
        "path": "vibe-sessions/README.md",
        "type": "modified",
        "description": ""
      },
      {
        "path": "vibe-sessions/analysis/session-stats.py",
        "type": "modified",
        "description": ""
      }
    ],
    "learnings": [
      "Structured data enables much better analysis than markdown files"
    ],
    "notes": "Final CSV-based session tracking system with comprehensive analysis capabilities",
    "duration": 60,
    "tags": [
      "documentation",
      "analysis",
      "integration"
    ],
    "priority": "high",
    "complexity": "moderate",
    "relatedSessions": [],
    "metadata": {
      "version": "2.0.0",
      "toolsUsed": [
        "CSV"
      ],
      "environment": "development",
      "codebaseSize": 100,
      "testsCovered": false
    }
  },
  {
    "sessionId": "2025-05-25-token-validation",
    "timestamp": "2025-05-25T08:00:00.000Z",
    "developer": "harshit-codes",
    "status": "completed",
    "focus": "GitHub Token Validation & remcode-test Access",
    "achievements": [
      "Session tracking update",
      "GitHub token analysis"
    ],
    "blockers": [
      "Limited GitHub permissions in remcode-test repository"
    ],
    "nextSteps": [
      "Resolve repository permissions and test remcode tools"
    ],
    "filesChanged": [
      {
        "path": "docs/SESSIONS.csv",
        "type": "modified",
        "description": ""
      }
    ],
    "learnings": [
      "GitHub token has read access but lacks push permissions to remcode-test"
    ],
    "notes": "Validating updated GitHub token for remcode tools functionality",
    "duration": 30,
    "tags": [
      "testing",
      "analysis",
      "security"
    ],
    "priority": "medium",
    "complexity": "simple",
    "relatedSessions": [],
    "metadata": {
      "version": "2.0.0",
      "toolsUsed": [
        "Git",
        "GitHub",
        "Testing"
      ],
      "environment": "development",
      "codebaseSize": 100,
      "testsCovered": true
    }
  },
  {
    "sessionId": "2025-05-25-oneshot-validation",
    "timestamp": "2025-05-25T08:30:00.000Z",
    "developer": "harshit-codes",
    "status": "completed",
    "focus": "One-Shot Permission Validation Strategy",
    "achievements": [
      "Permission validation strategy defined",
      "Session tracking updated"
    ],
    "blockers": [],
    "nextSteps": [
      "Implement one-shot validation for GitHub/HuggingFace/Pinecone"
    ],
    "filesChanged": [
      {
        "path": "docs/SESSIONS.csv",
        "type": "modified",
        "description": ""
      }
    ],
    "learnings": [
      "One-shot validation is much cleaner than complex permission scenarios"
    ],
    "notes": "Simplified strategy: validate all permissions upfront or fail with clear guidance",
    "duration": 45,
    "tags": [
      "testing",
      "security"
    ],
    "priority": "medium",
    "complexity": "simple",
    "relatedSessions": [],
    "metadata": {
      "version": "2.0.0",
      "toolsUsed": [],
      "environment": "development",
      "codebaseSize": 100,
      "testsCovered": false
    }
  },
  {
    "sessionId": "2025-05-25-fix-syntax-errors",
    "timestamp": "2025-05-25T09:00:00.000Z",
    "developer": "harshit-codes",
    "status": "completed",
    "focus": "Fixing TypeScript Compilation Errors",
    "achievements": [
      "Permission validation system created",
      "Syntax errors during integration"
    ],
    "blockers": [
      "TypeScript compilation errors from file edits"
    ],
    "nextSteps": [
      "Fix syntax errors and complete validation integration"
    ],
    "filesChanged": [
      {
        "path": "src/mcp/validation/ src/mcp/handlers/",
        "type": "modified",
        "description": ""
      }
    ],
    "learnings": [
      "Need to be more careful with file editing when dealing with class structures"
    ],
    "notes": "Validation system approach is correct but implementation needs cleaner integration",
    "duration": 30,
    "tags": [
      "feature",
      "bugfix",
      "refactor",
      "testing",
      "security",
      "integration"
    ],
    "priority": "medium",
    "complexity": "simple",
    "relatedSessions": [],
    "metadata": {
      "version": "2.0.0",
      "toolsUsed": [
        "TypeScript"
      ],
      "environment": "development",
      "codebaseSize": 100,
      "testsCovered": false
    }
  },
  {
    "sessionId": "2025-05-25-implementation-complete",
    "timestamp": "2025-05-25T09:30:00.000Z",
    "developer": "harshit-codes",
    "status": "completed",
    "focus": "One-Shot Permission Validation Implementation Complete",
    "achievements": [
      "SimpleValidator class",
      "Enhanced setup handler",
      "Package v0.1.3 published",
      "GitHub integration working"
    ],
    "blockers": [],
    "nextSteps": [
      "Test end-to-end validation with missing tokens scenario"
    ],
    "filesChanged": [
      {
        "path": "src/mcp/validation/simple-validator.ts",
        "type": "modified",
        "description": ""
      },
      {
        "path": "src/mcp/handlers/setup.ts",
        "type": "modified",
        "description": ""
      },
      {
        "path": "package.json",
        "type": "modified",
        "description": ""
      },
      {
        "path": "README.md",
        "type": "modified",
        "description": ""
      }
    ],
    "learnings": [
      "One-shot validation is much cleaner than complex scenarios - either all valid or clear guidance"
    ],
    "notes": "Successfully implemented and published one-shot permission validation system",
    "duration": 90,
    "tags": [
      "feature",
      "testing",
      "deployment",
      "security",
      "integration",
      "setup"
    ],
    "priority": "high",
    "complexity": "complex",
    "relatedSessions": [],
    "metadata": {
      "version": "2.0.0",
      "toolsUsed": [
        "Git",
        "GitHub"
      ],
      "environment": "development",
      "codebaseSize": 115,
      "testsCovered": false
    }
  },
  {
    "sessionId": "2025-05-25-validation-gap-identified",
    "timestamp": "2025-05-25T09:45:00.000Z",
    "developer": "harshit-codes",
    "status": "completed",
    "focus": "Critical Gap - Validation Only on Setup Tool",
    "achievements": [
      "Setup tool validation working",
      "Other tools bypass validation completely"
    ],
    "blockers": [
      "Other MCP tools lack validation guard"
    ],
    "nextSteps": [
      "Apply one-shot validation to ALL MCP tools"
    ],
    "filesChanged": [
      {
        "path": "ALL MCP handlers need validation guard integration",